{
  "candidate_scope": [
    "src/clamp.py",
    "src/clamp.py::clamp_percent",
    "tests/test_clamp.py"
  ],
  "failure": null,
  "limitations": [
    "Per stage constraints, no formal root-cause analysis or code modification was performed.",
    "Repository is a minimal controlled demo; only one source module and one test module are relevant.",
    "The write of scope-discovery.json via shell was denied by sandbox; result is returned via the structured output channel."
  ],
  "outcome": "candidates",
  "schema_version": 1,
  "search_entry_points": [
    "src/clamp.py:1",
    "src/clamp.py:2",
    "tests/test_clamp.py:3"
  ],
  "source": {
    "id": "project-source",
    "revision": "21fea08df5b2e46971b249d041dc7b6517508dfd"
  },
  "summary": "The ticket FAKE-HAIKU-001 reports that clamp_percent returns the wrong boundary. src/clamp.py defines clamp_percent(value) as `min(0, max(100, value))`, which always evaluates to 0 because max(100, value) is at least 100 and min(0, ...) caps it at 0. The expected behavior described in the ticket and verified by tests/test_clamp.py is: return 0 for values below 0, preserve values from 0 through 100, and return 100 for values above 100. The defect is localized to the clamp_percent implementation in src/clamp.py."
}
